{
  "as_of_utc": "2026-11-07T12:00:00Z",
  "assumptions": {
    "billing_settle_hours": 24.0,
    "canary_p95_min_queries": 300.0,
    "canary_p95_regression_pct": 40.0,
    "cold_start_added_share_max_pct": 10.0,
    "failure_cancel_pct_downsize_safe": 5.0,
    "min_query_sample_size": 100.0,
    "queue_query_pct_safe": 1.0,
    "restart_cost_cluster_minutes_pro_classic": 4.0,
    "restart_cost_cluster_minutes_serverless": 0.1,
    "severity_min_affected_queries": 20.0,
    "spill_query_pct_downsize_safe": 0.1
  },
  "aws": {
    "post": {
      "blocker": null,
      "cluster_hourly_price": 7.488,
      "currency": "USD",
      "region": "us-east-1",
      "status": "MODELED"
    },
    "pre": {
      "blocker": null,
      "cluster_hourly_price": 7.488,
      "currency": "USD",
      "region": "us-east-1",
      "status": "MODELED"
    }
  },
  "billing": {
    "billing_watermark": "2026-11-07T06:00:00+00:00",
    "settled_through": "2026-11-05",
    "watermark_source": "WORKSPACE"
  },
  "daily_cost": [
    {
      "currency_code": "USD",
      "dbu_quantity": 242.412927,
      "epoch_start": "2025-07-01T00:00:00+00:00",
      "list_cost": 133.32711,
      "restated_dbu_quantity": 0.0,
      "retracted_dbu_quantity": 0.0,
      "unpriced_dbu_quantity": 0.0,
      "usage_date": "2025-11-07"
    },
    {
      "currency_code": "USD",
      "dbu_quantity": 239.106234,
      "epoch_start": "2025-07-01T00:00:00+00:00",
      "list_cost": 131.508429,
      "restated_dbu_quantity": 0.0,
      "retracted_dbu_quantity": 0.0,
      "unpriced_dbu_quantity": 0.0,
      "usage_date": "2025-11-10"
    },
    {
      "currency_code": "USD",
      "dbu_quantity": 243.866965,
      "epoch_start": "2025-07-01T00:00:00+00:00",
      "list_cost": 134.126831,
      "restated_dbu_quantity": 0.0,
      "retracted_dbu_quantity": 0.0,
      "unpriced_dbu_quantity": 0.0,
      "usage_date": "2025-11-11"
    },
    {
      "currency_code": "USD",
      "dbu_quantity": 238.22539,
      "epoch_start": "2025-07-01T00:00:00+00:00",
      "list_cost": 131.023965,
      "restated_dbu_quantity": 0.0,
      "retracted_dbu_quantity": 0.0,
      "unpriced_dbu_quantity": 0.0,
      "usage_date": "2025-11-12"
    },
    {
      "currency_code": "USD",
      "dbu_quantity": 237.780142,
      "epoch_start": "2025-07-01T00:00:00+00:00",
      "list_cost": 130.779078,
      "restated_dbu_quantity": 0.0,
      "retracted_dbu_quantity": 0.0,
      "unpriced_dbu_quantity": 0.0,
      "usage_date": "2025-11-13"
    },
    {
      "currency_code": "USD",
      "dbu_quantity": 243.406723,
      "epoch_start": "2025-07-01T00:00:00+00:00",
      "list_cost": 133.873698,
      "restated_dbu_quantity": 0.0,
      "retracted_dbu_quantity": 0.0,
      "unpriced_dbu_quantity": 0.0,
      "usage_date": "2025-11-14"
    },
    {
      "currency_code": "USD",
      "dbu_quantity": 236.821889,
      "epoch_start": "2025-07-01T00:00:00+00:00",
      "list_cost": 130.252039,
      "restated_dbu_quantity": 0.0,
      "retracted_dbu_quantity": 0.0,
      "unpriced_dbu_quantity": 0.0,
      "usage_date": "2025-11-17"
    },
    {
      "currency_code": "USD",
      "dbu_quantity": 237.113423,
      "epoch_start": "2025-07-01T00:00:00+00:00",
      "list_cost": 130.412383,
      "restated_dbu_quantity": 0.0,
      "retracted_dbu_quantity": 0.0,
      "unpriced_dbu_quantity": 0.0,
      "usage_date": "2025-11-18"
    },
    {
      "currency_code": "USD",
      "dbu_quantity": 235.696027,
      "epoch_start": "2025-07-01T00:00:00+00:00",
      "list_cost": 129.632815,
      "restated_dbu_quantity": 0.0,
      "retracted_dbu_quantity": 0.0,
      "unpriced_dbu_quantity": 0.0,
      "usage_date": "2025-11-19"
    },
    {
      "currency_code": "USD",
      "dbu_quantity": 237.611346,
      "epoch_start": "2025-07-01T00:00:00+00:00",
      "list_cost": 130.68624,
      "restated_dbu_quantity": 0.0,
      "retracted_dbu_quantity": 0.0,
      "unpriced_dbu_quantity": 0.0,
      "usage_date": "2025-11-20"
    },
    {
      "currency_code": "USD",
      "dbu_quantity": 232.099035,
      "epoch_start": "2025-07-01T00:00:00+00:00",
      "list_cost": 127.654469,
      "restated_dbu_quantity": 0.0,
      "retracted_dbu_quantity": 0.0,
      "unpriced_dbu_quantity": 0.0,
      "usage_date": "2025-11-21"
    },
    {
      "currency_code": "USD",
      "dbu_quantity": 234.413214,
      "epoch_start": "2025-07-01T00:00:00+00:00",
      "list_cost": 128.927268,
      "restated_dbu_quantity": 0.0,
      "retracted_dbu_quantity": 0.0,
      "unpriced_dbu_quantity": 0.0,
      "usage_date": "2025-11-24"
    },
    {
      "currency_code": "USD",
      "dbu_quantity": 239.932635,
      "epoch_start": "2025-07-01T00:00:00+00:00",
      "list_cost": 131.962949,
      "restated_dbu_quantity": 0.0,
      "retracted_dbu_quantity": 0.0,
      "unpriced_dbu_quantity": 0.0,
      "usage_date": "2025-11-25"
    },
    {
      "currency_code": "USD",
      "dbu_quantity": 243.269837,
      "epoch_start": "2025-07-01T00:00:00+00:00",
      "list_cost": 133.79841,
      "restated_dbu_quantity": 0.0,
      "retracted_dbu_quantity": 0.0,
      "unpriced_dbu_quantity": 0.0,
      "usage_date": "2025-11-26"
    },
    {
      "currency_code": "USD",
      "dbu_quantity": 244.801732,
      "epoch_start": "2025-07-01T00:00:00+00:00",
      "list_cost": 134.640953,
      "restated_dbu_quantity": 0.0,
      "retracted_dbu_quantity": 0.0,
      "unpriced_dbu_quantity": 0.0,
      "usage_date": "2025-11-27"
    },
    {
      "currency_code": "USD",
      "dbu_quantity": 232.876697,
      "epoch_start": "2025-07-01T00:00:00+00:00",
      "list_cost": 128.082183,
      "restated_dbu_quantity": 0.0,
      "retracted_dbu_quantity": 0.0,
      "unpriced_dbu_quantity": 0.0,
      "usage_date": "2025-11-28"
    },
    {
      "currency_code": "USD",
      "dbu_quantity": 234.579972,
      "epoch_start": "2025-07-01T00:00:00+00:00",
      "list_cost": 129.018985,
      "restated_dbu_quantity": 0.0,
      "retracted_dbu_quantity": 0.0,
      "unpriced_dbu_quantity": 0.0,
      "usage_date": "2025-12-01"
    },
    {
      "currency_code": "USD",
      "dbu_quantity": 236.46373,
      "epoch_start": "2025-07-01T00:00:00+00:00",
      "list_cost": 130.055052,
      "restated_dbu_quantity": 0.0,
      "retracted_dbu_quantity": 0.0,
      "unpriced_dbu_quantity": 0.0,
      "usage_date": "2025-12-02"
    },
    {
      "currency_code": "USD",
      "dbu_quantity": 233.950445,
      "epoch_start": "2025-07-01T00:00:00+00:00",
      "list_cost": 128.672745,
      "restated_dbu_quantity": 0.0,
      "retracted_dbu_quantity": 0.0,
      "unpriced_dbu_quantity": 0.0,
      "usage_date": "2025-12-03"
    },
    {
      "currency_code": "USD",
      "dbu_quantity": 234.674116,
      "epoch_start": "2025-07-01T00:00:00+00:00",
      "list_cost": 129.070764,
      "restated_dbu_quantity": 0.0,
      "retracted_dbu_quantity": 0.0,
      "unpriced_dbu_quantity": 0.0,
      "usage_date": "2025-12-04"
    },
    {
      "currency_code": "USD",
      "dbu_quantity": 237.603916,
      "epoch_start": "2025-07-01T00:00:00+00:00",
      "list_cost": 130.682154,
      "restated_dbu_quantity": 0.0,
      "retracted_dbu_quantity": 0.0,
      "unpriced_dbu_quantity": 0.0,
      "usage_date": "2025-12-05"
    },
    {
      "currency_code": "USD",
      "dbu_quantity": 242.117047,
      "epoch_start": "2025-07-01T00:00:00+00:00",
      "list_cost": 133.164376,
      "restated_dbu_quantity": 0.0,
      "retracted_dbu_quantity": 0.0,
      "unpriced_dbu_quantity": 0.0,
      "usage_date": "2025-12-08"
    },
    {
      "currency_code": "USD",
      "dbu_quantity": 243.906801,
      "epoch_start": "2025-07-01T00:00:00+00:00",
      "list_cost": 134.148741,
      "restated_dbu_quantity": 0.0,
      "retracted_dbu_quantity": 0.0,
      "unpriced_dbu_quantity": 0.0,
      "usage_date": "2025-12-09"
    },
    {
      "currency_code": "USD",
      "dbu_quantity": 238.354117,
      "epoch_start": "2025-07-01T00:00:00+00:00",
      "list_cost": 131.094764,
      "restated_dbu_quantity": 0.0,
      "retracted_dbu_quantity": 0.0,
      "unpriced_dbu_quantity": 0.0,
      "usage_date": "2025-12-10"
    },
    {
      "currency_code": "USD",
      "dbu_quantity": 240.984348,
      "epoch_start": "2025-07-01T00:00:00+00:00",
      "list_cost": 132.541391,
      "restated_dbu_quantity": 0.0,
      "retracted_dbu_quantity": 0.0,
      "unpriced_dbu_quantity": 0.0,
      "usage_date": "2025-12-11"
    },
    {
      "currency_code": "USD",
      "dbu_quantity": 233.331251,
      "epoch_start": "2025-07-01T00:00:00+00:00",
      "list_cost": 128.332188,
      "restated_dbu_quantity": 0.0,
      "retracted_dbu_quantity": 0.0,
      "unpriced_dbu_quantity": 0.0,
      "usage_date": "2025-12-12"
    },
    {
      "currency_code": "USD",
      "dbu_quantity": 234.277777,
      "epoch_start": "2025-07-01T00:00:00+00:00",
      "list_cost": 128.852777,
      "restated_dbu_quantity": 0.0,
      "retracted_dbu_quantity": 0.0,
      "unpriced_dbu_quantity": 0.0,
      "usage_date": "2025-12-15"
    },
    {
      "currency_code": "USD",
      "dbu_quantity": 240.325997,
      "epoch_start": "2025-07-01T00:00:00+00:00",
      "list_cost": 132.179298,
      "restated_dbu_quantity": 0.0,
      "retracted_dbu_quantity": 0.0,
      "unpriced_dbu_quantity": 0.0,
      "usage_date": "2025-12-16"
    },
    {
      "currency_code": "USD",
      "dbu_quantity": 233.726479,
      "epoch_start": "2025-07-01T00:00:00+00:00",
      "list_cost": 128.549563,
      "restated_dbu_quantity": 0.0,
      "retracted_dbu_quantity": 0.0,
      "unpriced_dbu_quantity": 0.0,
      "usage_date": "2025-12-17"
    },
    {
      "currency_code": "USD",
      "dbu_quantity": 244.919984,
      "epoch_start": "2025-07-01T00:00:00+00:00",
      "list_cost": 134.705991,
      "restated_dbu_quantity": 0.0,
      "retracted_dbu_quantity": 0.0,
      "unpriced_dbu_quantity": 0.0,